[
  {
    "datei": "Deggendorf/HH-Internet-Ausg-Einn-Internetdarstellung-1-1.pdf",
    "titel": "Haushaltsübersicht 2018–2026: wichtigste Einnahme- und Ausgabearten (in 1.000 €)",
    "herausgeber": "Stadt Deggendorf (Stadtkämmerei)",
    "url": "https://anmelden.deggendorf.de/wp-content/deg-forms-analog/kaemmerei/HH-Internet-Ausg-Einn-Internetdarstellung-1-1.pdf",
    "abgerufen": "2026-10-02",
    "sha256": "116b21a30d05fdffbab8fb93a125114911cd4fb12e4cd73744270b09755abfd6",
    "bytes": 10749,
    "datensaetze": [
      "09271119_2018",
      "09271119_2019",
      "09271119_2020",
      "09271119_2021",
      "09271119_2022",
      "09271119_2023",
      "09271119_2024",
      "09271119_2025",
      "09271119_2026"
    ]
  },
  {
    "datei": "Deggendorf/stadt-deggendorf-amtsblatt-01-2021.pdf",
    "titel": "Amtsblatt der Stadt Deggendorf Nr. 1 vom 22.01.2021 (Haushaltssatzung 2021)",
    "herausgeber": "Stadt Deggendorf",
    "url": "https://www.deggendorf.de/media/deg-media/_dokumente/stadt-deggendorf-amtsblatt-01-2021.pdf",
    "abgerufen": "2026-10-02",
    "sha256": "0be28f5747d0147400a604ef9130a55b44b4f749b437934f4bcdebef8f46d52b",
    "bytes": 3762297,
    "datensaetze": ["09271119_2021"]
  },
  {
    "datei": "Deggendorf/stadt-deggendorf-amtsblatt-01.pdf",
    "titel": "Amtsblatt der Stadt Deggendorf Nr. 1 vom 27.01.2023 (Haushaltssatzung 2023)",
    "herausgeber": "Stadt Deggendorf",
    "url": "https://www.deggendorf.de/media/deg-media/_dokumente/stadt-deggendorf-amtsblatt-01.pdf",
    "abgerufen": "2026-10-02",
    "sha256": "80ed9dffe3ff792f076a2b3059f37ce0a757ddbd155382ae39d4df5ac0ae46b1",
    "bytes": 2163048,
    "datensaetze": ["09271119_2023"]
  },
  {
    "datei": "Deggendorf/stadt-deggendorf-amtsblatt-02-2.pdf",
    "titel": "Amtsblatt der Stadt Deggendorf Nr. 2 vom 12.03.2025 (Haushaltssatzung 2025)",
    "herausgeber": "Stadt Deggendorf",
    "url": "https://www.deggendorf.de/media/deg-media/_dokumente/stadt-deggendorf-amtsblatt-02-2.pdf",
    "abgerufen": "2026-10-02",
    "sha256": "27e2f6ca72424528c867cd5a290b6756959e4a4729c116f85b97e0ba9bfcea78",
    "bytes": 738746,
    "datensaetze": ["09271119_2025"]
  },
  {
    "datei": "Deggendorf/stadt-deggendorf-amtsblatt-05-3.pdf",
    "titel": "Amtsblatt der Stadt Deggendorf Nr. 5 vom 19.03.2026 (Haushaltssatzung 2026)",
    "herausgeber": "Stadt Deggendorf",
    "url": "https://www.deggendorf.de/media/deg-media/_dokumente/stadt-deggendorf-amtsblatt-05-3.pdf",
    "abgerufen": "2026-10-02",
    "sha256": "a0d200b86693726f4268907e4ecf719ef66a730eb3c2892d8b48d53dcc95f249",
    "bytes": 603152,
    "datensaetze": ["09271119_2026"]
  },
  {
    "datei": "Deggendorf/stadt-deggendorf-amtsblatt2024-01.pdf",
    "titel": "Amtsblatt der Stadt Deggendorf Nr. 1 vom 19.01.2024 (Haushaltssatzung 2024)",
    "herausgeber": "Stadt Deggendorf",
    "url": "https://www.deggendorf.de/media/deg-media/_dokumente/stadt-deggendorf-amtsblatt2024-01.pdf",
    "abgerufen": "2026-10-02",
    "sha256": "6b5ac86a4523dc17e97e9cae35540319a2ec100ee9bf95791a24b3d3d88e3dbc",
    "bytes": 612118,
    "datensaetze": ["09271119_2024"]
  },
  {
    "datei": "Deggendorf/stadt-deggendorf-amtsblatt_01_2022.pdf",
    "titel": "Amtsblatt der Stadt Deggendorf Nr. 1 vom 28.01.2022 (Haushaltssatzung 2022)",
    "herausgeber": "Stadt Deggendorf",
    "url": "https://www.deggendorf.de/media/deg-media/_dokumente/stadt-deggendorf-amtsblatt_01_2022.pdf",
    "abgerufen": "2026-10-02",
    "sha256": "30e5047966ddde2b3e083d222dbf41b20077e7b7ab335ba49c7b4b0a6455f62d",
    "bytes": 1118751,
    "datensaetze": ["09271119_2022"]
  },
  {
    "datei": "Deggendorf/stadt-deggendorf-deggendorf-amtsblatt-2020-01.pdf",
    "titel": "Amtsblatt der Stadt Deggendorf Nr. 1 vom 15.01.2020 (Haushaltssatzung 2020)",
    "herausgeber": "Stadt Deggendorf",
    "url": "https://www.deggendorf.de/media/deg-media/_dokumente/stadt-deggendorf-deggendorf-amtsblatt-2020-01.pdf",
    "abgerufen": "2026-10-02",
    "sha256": "04729c21d50a1876e8820d8f8531035887618e5e6f0a7ac2efb19d563a7402ca",
    "bytes": 3793972,
    "datensaetze": ["09271119_2020"]
  },
  {
    "datei": "Erding/Haushaltssatzung_Stadt_Erding_2026.pdf",
    "titel": "Haushaltssatzung 2026",
    "herausgeber": "Stadt Erding",
    "url": "https://www.erding.de/files/Erding/2024/Rathaus/Allgemeine%20Informationen/Ortsrecht/Satzungen/Dokumente/Haushalt/Haushaltssatzung%20Stadt%20Erding%202026.pdf",
    "abgerufen": "2026-10-02",
    "sha256": "713a3652a60718ac6e20b5ef3a4d8ada5a05412b0a38889ae8e778714ce86c2a",
    "bytes": 330137,
    "datensaetze": ["09177117_2026"]
  },
  {
    "datei": "Erding/HH_Stadt_0525.pdf",
    "titel": "Haushaltssatzung 2025",
    "herausgeber": "Stadt Erding",
    "url": "https://www.erding.de/files/Erding/2024/Rathaus/Allgemeine%20Informationen/Ortsrecht/Satzungen/Dokumente/Haushalt/HH%20Stadt%200525.pdf",
    "abgerufen": "2026-10-02",
    "sha256": "d71d3deab40c91b773b94b9c96482d3ecb4be05f8f774031201b588fcfd30128",
    "bytes": 164100,
    "datensaetze": ["09177117_2025"]
  },
  {
    "datei": "Haar/2023_Beschluss_Haushaltssatzung_2023.pdf",
    "titel": "Beschluss der Haushaltssatzung 2023 (Gemeinderat, 29.11.2022)",
    "herausgeber": "Stadt Haar",
    "url": "https://haar.gremien.info/api.php?document_type_id=5&document_relation_id=ni_AD-767%7CAD-7798%7C1&agenda_item_id=ni_AD-767%7CAD-7798%7C1&id=69&json=1&platform=web&system=ris",
    "abgerufen": "2026-10-02",
    "sha256": "8455d7195696db58f3f14552a52a6ce2d15b8a7bb6f048eb6a132053a3ce1f69",
    "bytes": 150261,
    "datensaetze": ["09184123_2023"]
  },
  {
    "datei": "Haar/2025_1_EP_d._VwHH_2025.pdf",
    "titel": "Haushaltsplan 2025: Einzelpläne des Verwaltungshaushalts (Gemeinderat, 26.11.2024)",
    "herausgeber": "Stadt Haar",
    "url": "https://haar.gremien.info/api.php?document_type_id=13&document_relation_id=20241911100374%7C20241122083523-0.pdf%7C&submission_attachment_id=20241911100374%7C20241122083523-0.pdf%7C&id=69&json=1&platform=web&system=ris",
    "abgerufen": "2026-10-02",
    "sha256": "d92d21943c0722c77b0a2ac104ba30fedd3d955d7e5b86e2beb58910b4ec0b51",
    "bytes": 1867890,
    "datensaetze": ["09184123_2023"]
  },
  {
    "datei": "Haar/2025_2_EP_d._VmHH_2025.pdf",
    "titel": "Haushaltsplan 2025: Einzelpläne des Vermögenshaushalts (Gemeinderat, 26.11.2024)",
    "herausgeber": "Stadt Haar",
    "url": "https://haar.gremien.info/api.php?document_type_id=13&document_relation_id=20241911100374%7C20241122083551-0.pdf%7C&submission_attachment_id=20241911100374%7C20241122083551-0.pdf%7C&id=69&json=1&platform=web&system=ris",
    "abgerufen": "2026-10-02",
    "sha256": "0edd37066d3b157c531fc69f3b1080d3e210eb585502b53b305d4e784cc876cd",
    "bytes": 580304,
    "datensaetze": ["09184123_2023"]
  },
  {
    "datei": "Haar/2025_Beschluss_Haushaltssatzung_2025.pdf",
    "titel": "Beschluss der Haushaltssatzung 2025 (Gemeinderat, 26.11.2024)",
    "herausgeber": "Stadt Haar",
    "url": "https://haar.gremien.info/api.php?document_type_id=5&document_relation_id=ni_2024-GR-260%7C20242111100388%7C1&agenda_item_id=ni_2024-GR-260%7C20242111100388%7C1&id=69&json=1&platform=web&system=ris",
    "abgerufen": "2026-10-02",
    "sha256": "96bb268897a0f8d02f4d407b78929ab55a9d7673493fd949bb3aee32838c78fd",
    "bytes": 60826,
    "datensaetze": ["09184123_2025"]
  },
  {
    "datei": "Haar/2026_03_2_Verwaltungshaushalt_2026_-_Einzelplan.pdf",
    "titel": "Haushaltsplan 2026: Einzelpläne des Verwaltungshaushalts (Stadtrat, 25.11.2025)",
    "herausgeber": "Stadt Haar",
    "url": "https://haar.gremien.info/api.php?document_type_id=13&document_relation_id=20250511100306%7C20251120102514-0.pdf%7C&submission_attachment_id=20250511100306%7C20251120102514-0.pdf%7C&id=69&json=1&platform=web&system=ris",
    "abgerufen": "2026-10-02",
    "sha256": "0ad19d95736208bf06c7c6a05b57560bdce0102b1bb6d120e121362b807b3d4c",
    "bytes": 14313787,
    "datensaetze": ["09184123_2024", "09184123_2025", "09184123_2026"]
  },
  {
    "datei": "Haar/2026_04_3_Vermögenshaushalt_2026_-_Einzelplan.pdf",
    "titel": "Haushaltsplan 2026: Einzelpläne des Vermögenshaushalts (Stadtrat, 25.11.2025)",
    "herausgeber": "Stadt Haar",
    "url": "https://haar.gremien.info/api.php?document_type_id=13&document_relation_id=20250511100306%7C20251120102534-0.pdf%7C&submission_attachment_id=20250511100306%7C20251120102534-0.pdf%7C&id=69&json=1&platform=web&system=ris",
    "abgerufen": "2026-10-02",
    "sha256": "b7af01bc821d803ee44fc699370a52ce3af3069cdcb11069804ba078e9985add",
    "bytes": 3740772,
    "datensaetze": ["09184123_2024", "09184123_2025", "09184123_2026"]
  },
  {
    "datei": "Haar/2026_12_11_Übersicht_über_den_Stand_der_Rücklagen.pdf",
    "titel": "Haushaltsplan 2026: Übersicht über den Stand der Rücklagen",
    "herausgeber": "Stadt Haar",
    "url": "https://haar.gremien.info/api.php?document_type_id=13&document_relation_id=20250511100306%7C20251120150845-0.pdf%7C&submission_attachment_id=20250511100306%7C20251120150845-0.pdf%7C&id=69&json=1&platform=web&system=ris",
    "abgerufen": "2026-10-02",
    "sha256": "61fe40409f9479d8c994250065692271cf37c28c8634593e5979ee1f5886bc6c",
    "bytes": 15271,
    "datensaetze": ["09184123_2025", "09184123_2026"]
  },
  {
    "datei": "Haar/2026_14_13_Übersicht_über_d._vor._Stand_d._Schulden_Seite_1.pdf",
    "titel": "Haushaltsplan 2026: Übersicht über den voraussichtlichen Stand der Schulden, Seite 1",
    "herausgeber": "Stadt Haar",
    "url": "https://haar.gremien.info/api.php?document_type_id=13&document_relation_id=20250511100306%7C20251120125500-0.pdf%7C&submission_attachment_id=20250511100306%7C20251120125500-0.pdf%7C&id=69&json=1&platform=web&system=ris",
    "abgerufen": "2026-10-02",
    "sha256": "49f792f71b6f405e5c536bfcd204b2daff2946cbeed4aac8a58516093638a233",
    "bytes": 89727,
    "datensaetze": ["09184123_2026"]
  },
  {
    "datei": "Haar/2026_15_13_Übersicht_über_d._vor._Stand_d._Schulden_Seite_2.pdf",